,title,urlToImage,url
0,2022 Masters: Tiger Woods' unforgettable 71 in return to golf even more remarkable than it seems - CBS Sports,https://sportshub.cbsistatic.com/i/r/2022/04/07/a3ad80e0-e7b2-4f8a-8b84-3dfaf6da0b6f/thumbnail/1200x675/9e70420680e182ae4ebdd767e0475a62/tiger-woods-r1-18-final-masters-2022-g.jpg,https://www.cbssports.com/golf/news/2022-masters-tiger-woods-unforgettable-71-in-return-to-golf-even-more-remarkable-than-it-seems/
1,"Walmart boosts industry-leading U.S. trucker pay to $110000, starts retraining program - Reuters.com",https://www.reuters.com/resizer/A5ytKcWzNOEQ2suUgfn6cFeOG6E=/1200x628/smart/filters:quality(80)/cloudfront-us-east-2.images.arcpublishing.com/reuters/HYMUMDULMRKWTJ6N3CUTWD63UI.jpg,https://www.reuters.com/business/retail-consumer/walmart-boosts-industry-leading-us-trucker-pay-110000-starts-retraining-program-2022-04-07/
2,What else is new? Ohtani makes more history - MLB.com,https://img.mlbstatic.com/mlb-images/image/private/t_2x1/t_w1536/v1649385312/mlb/ibgj73airjmjkk0d2oni.jpg,https://www.mlb.com/news/ohtani-first-to-throw-pitch-lead-off-to-start-season
3,"Nikola Jokic first with 2K points, 1K rebounds, 500 assists; leads Denver Nuggets to playoff berth - ESPN",https://a4.espncdn.com/combiner/i?img=%2Fphoto%2F2022%2F0408%2Fr996821_1024x576_16%2D9.jpg,https://www.espn.com/nba/story/_/id/33694949/nikola-jokic-creates-new-statistical-club-denver-nuggets-clinch-playoff-berth
4,Borodianka razed: Ukraine's Zelenskiy says situation 'more dreadful' than Bucha - Reuters.com,https://www.reuters.com/resizer/B0a8pw8vxxlG-QMLZ6z6wCBWqag=/1200x628/smart/filters:quality(80)/cloudfront-us-east-2.images.arcpublishing.com/reuters/QDA37QIXN5PD5OW5U7JFE7JEME.jpg,https://www.reuters.com/world/europe/situation-ukraines-borodyanka-more-dreadful-than-bucha-zelenskiy-2022-04-07/
5,Former University of Kansas professor found guilty of hiding ties to China - New York Post ,https://nypost.com/wp-content/uploads/sites/2/2022/04/newspress-collage-21826060-1649393322384.png?w=1024,https://nypost.com/2022/04/08/former-university-of-kansas-professor-feng-tao-found-guilty-of-hiding-ties-to-china/
6,"Tesla Will Sell Its Cybertruck Next Year, Elon Musk Says - The New York Times",https://static01.nyt.com/images/2022/04/08/world/08tesla-01/08tesla-01-facebookJumbo.jpg,https://www.nytimes.com/2022/04/08/business/tesla-cybertruck-elon-musk.html
7,"Tylor Megill, balanced offense propel Mets to win over Nationals in opener - New York Post ",https://nypost.com/wp-content/uploads/sites/2/2022/04/Robinson-Cano.jpg?quality=75&strip=all&w=1024,https://nypost.com/2022/04/08/tylor-megill-offense-propel-mets-to-win-over-nationals/
8,Spirit Airlines to start talks with JetBlue on its $3.6 billion bid - Fox Business,https://a57.foxnews.com/static.foxbusiness.com/foxbusiness.com/content/uploads/2021/08/0/0/spirit-airlines.png?ve=1&tl=1,https://www.foxbusiness.com/markets/spirit-airlines-to-start-talks-with-jetblue-on-its-3-6-billion-bid
9,'Pretty damn lucky': Fox News' Benjamin Hall gives update after Ukraine attack - New York Post ,https://nypost.com/wp-content/uploads/sites/2/2022/04/newspress-collage-21825441-1649385014747.png?w=1024,https://nypost.com/2022/04/07/fox-news-benjamin-hall-loses-limbs-after-ukraine-attack/
10,Pink Floyd to release first new music in 28 years in support of Ukraine - CNN,https://cdn.cnn.com/cnnnext/dam/assets/220407211942-01-pink-floyd-ukraine-song-super-tease.jpg,https://www.cnn.com/2022/04/07/entertainment/ukraine-pink-floyd-new-music-intl-hnk/index.html
11,Will Smith’s Oscars slap has been a ‘nightmare’ for his family: report - Yahoo News,https://s.yimg.com/ny/api/res/1.2/1wmxgXdBWgclecWq56k7jw--/YXBwaWQ9aGlnaGxhbmRlcjt3PTEyMDA7aD02NzU-/https://s.yimg.com/uu/api/res/1.2/baFYBjnLVSkgufB_VGF7Fw--~B/aD03MjA7dz0xMjgwO2FwcGlkPXl0YWNoeW9u/https://media.zenfs.com/en/fox_news_text_979/bf43ba40e11dc8bc352c1af191a5906e,https://news.yahoo.com/smith-oscars-slap-nightmare-family-001356208.html
12,Alabama passes bill making some transgender healthcare a felony - Reuters.com,https://www.reuters.com/resizer/vEMgOpvHT8J5C5Tef0nIRLi3hNs=/728x381/smart/filters:quality(80)/cloudfront-us-east-2.images.arcpublishing.com/reuters/SI2KKRL3KRLQZPOIYQETBKANH4.jpg,https://www.reuters.com/legal/litigation/alabama-lawmakers-pass-bill-criminalizing-transgender-healthcare-2022-04-07/
13,Long COVID symptoms: Major issue happens 3 to 6 months later - Deseret News,https://deseret.brightspotcdn.com/dims4/default/63871b9/2147483647/strip/true/crop/3000x1713+0+144/resize/1461x834!/quality/90/?url=https%3A%2F%2Fcdn.vox-cdn.com%2Fthumbor%2FDLoqRetaQW59_BZirxymm9FbGs0%3D%2F0x0%3A3000x2000%2F3000x2000%2Ffilters%3Afocal%281500x1000%3A1501x1001%29%2Fcdn.vox-cdn.com%2Fuploads%2Fchorus_asset%2Ffile%2F23128137%2Fomicron2.jpg,https://www.deseret.com/coronavirus/2022/4/7/23014665/new-long-covid-symptoms-blood-clot-risks
14,Men accused of impersonating federal agents being investigated for possible ties to Iranian intelligence - CBS News,https://cbsnews3.cbsistatic.com/hub/i/r/2022/04/08/335fb85f-4fee-4226-b4f7-f7d26099b1cf/thumbnail/1200x630/80d1b9bac24553eaa1a3d20554bd8b8c/fbi-arrest-in-eastern-market-must-credit-philipcoppage-2.jpg,https://www.cbsnews.com/news/secret-service-arian-taherzadeh-haider-ali-investgiation-possible-ties-to-iranian-intelligence/
15,Anita Hill calls Ketanji Brown Jackson confirmation an 'important cultural moment' - CNN,https://cdn.cnn.com/cnnnext/dam/assets/220407172355-anita-hill-2021-super-tease.jpg,https://www.cnn.com/2022/04/07/politics/anita-hill-ketanji-brown-jackson-supreme-court-cnntv/index.html
16,An Unexpected Boson Measurement Is Threatening The Standard Model of Physics - ScienceAlert,https://www.sciencealert.com/images/2022-04/processed/BosonIllustration_1024.jpg,https://www.sciencealert.com/boson-discovery-contradicts-our-current-understanding-of-the-universe
17,"Sens. Susan Collins, Raphael Warnock Tests Positive for COVID After Supreme Court Vote - The Daily Beast","https://img.thedailybeast.com/image/upload/c_crop,d_placeholder_euli9k,h_2735,w_4863,x_768,y_1243/dpr_2.0/c_limit,w_740/fl_lossy,q_auto/v1649375239/GettyImages-1239811655_oc1nfw",https://www.thedailybeast.com/sen-susan-collins-tests-positive-for-covid-19-hours-after-confirming-ketanji-brown-jackson-to-supreme-court
18,Los Angeles Covid Cases Rise 33% And School Outbreaks Triple As BA.2 Variant Surges - Deadline,https://deadline.com/wp-content/uploads/2021/03/AdobeStock_90015597.jpeg?w=1024,https://deadline.com/2022/04/los-angeles-covid-rise-school-outbreaks-ba-2-1234996879/
19,"Criminal investigation into Trump and his company continues as prosecutors review new evidence, NY DA says - CNN",https://cdn.cnn.com/cnnnext/dam/assets/220224172007-trump-alvin-bragg-split-super-tease.jpg,https://www.cnn.com/2022/04/07/politics/alvin-bragg-trump-investigation/index.html
